{
  "fingerprint_mode": "content",
  "http_timeout_seconds": 30,
  "official_validator_command": "validation/codex/external/midi-validator.cmd",
  "rsna_anonymizer_command": "validation/codex/external/rsna/run-rsna-anonymizer.cmd",
  "rsna_ctp_command": "validation/codex/external/rsna/run-ctp.cmd",
  "orthanc_http_url": "http://127.0.0.1:8042/system",
  "orthanc_dimse_host": "127.0.0.1",
  "orthanc_dimse_port": 4242,
  "dicomweb_url": "http://127.0.0.1:8042/dicom-web/studies?limit=1"
}
